{
  "id": "ide",
  "label": "Workbench: nav, main, inspector, dock",
  "regions": ["header", "nav", "main", "inspector", "dock", "strip"],
  "grid": {
    "columns": ["minmax(0, 1fr)", "minmax(0, 4fr)", "minmax(0, 1.5fr)"],
    "rows": ["auto", "minmax(0, 3fr)", "minmax(0, 1fr)", "auto"],
    "areas": ["header header header", "nav main inspector", "nav dock inspector", "strip strip strip"]
  }
}
